{"commands":{"build":"","lint":"","test":"npm test"},"entrypoints":["bin/modonome.mjs"],"generated_at":"2026-07-28T04:12:19.462Z","generated_for":"modonome","governance":{"armed":false,"autonomy_enabled":false,"dry_run":true},"instructions":["AGENTS.md","CLAUDE.md","CODEX.md","CONTRIBUTING.md","README.md"],"language_mix":{"(none)":12,"cff":1,"css":50,"diff":18,"html":9,"js":19,"json":139,"jsonl":8,"md":144,"mjs":351,"patch":40,"png":5,"py":4,"sh":1,"svg":2,"tf":4,"toml":2,"ts":61,"tsx":98,"txt":18,"webmanifest":1,"webp":1,"woff2":9,"xml":1,"yaml":9,"yml":22},"merkle_root":"sha256:dca28c65d51d01c292b89d9192cb802ddac2149e6c74f1556ab04c4645f52fed","preamble":"Modonome snapshot. Read this before reading the repo. Tier 0 (signature.json) is the fingerprint: if merkle_root matches your last read, nothing changed. Tier 1 (map.json / map.md) lists modules, public API signatures, import edges, and attention ranking. Cite anchors (F: for files, S: for symbols); each resolves to a path and line so you can act without re-reading the whole repo.","protected_paths":[".github",".github/CODEOWNERS","package-lock.json"],"schema_version":1,"size":{"bytes":3805193,"files":1029},"snapshot_version":1,"stack":{"name":"Node or TypeScript","pm":"npm"},"tier_hashes":{"map":"sha256:cb3c8d3b84c136a4c779462b3b71f54ca55b353b7495d3573cf076710ea3dfba","map_md":"sha256:809f6d1dacbcd64f812441062db4376c61a8eb77e0f11a60b7da2ae051d17e7f"}}
